{"$schema":"https://json-schema.org/draft/2020-12/schema","$id":"https://github.com/gj3447/agent-coding-paradigm/spec/schema/m4a-manifest.v1.schema.json","type":"object","additionalProperties":false,"required":["schema_version","status","normative_contracts","inherited_dependencies","fixture","goldens","reference_implementation","documentation","tools","completion_boundary"],"properties":{"schema_version":{"const":"m4a-manifest/v1"},"status":{"const":"PROPOSED_PENDING_MEASUREMENT"},"normative_contracts":{"type":"array","minItems":6,"uniqueItems":true,"items":{"type":"string"}},"inherited_dependencies":{"type":"array","minItems":8,"uniqueItems":true,"items":{"type":"object","additionalProperties":false,"required":["artifact","sha256"],"properties":{"artifact":{"type":"string"},"sha256":{"type":"string","pattern":"^sha256:[0-9a-f]{64}$"}}}},"fixture":{"const":"fixtures/m4a/cases.json"},"goldens":{"type":"array","minItems":3,"uniqueItems":true,"items":{"type":"string"}},"reference_implementation":{"type":"array","minItems":3,"uniqueItems":true,"items":{"type":"string"}},"documentation":{"type":"array","minItems":1,"uniqueItems":true,"items":{"type":"string"}},"tools":{"type":"array","minItems":8,"uniqueItems":true,"items":{"type":"string"}},"completion_boundary":{"type":"string"}}}
