{
  "schema_version":"m4a-manifest/v1","status":"PROPOSED_PENDING_MEASUREMENT",
  "normative_contracts":["spec/m4a-authority-contract.v1.json","spec/m4a-manifest.v1.json","spec/schema/m4a-authority.v1.schema.json","spec/schema/m4a-contract.v1.schema.json","spec/schema/m4a-fixtures.v1.schema.json","spec/schema/m4a-manifest.v1.schema.json"],
  "inherited_dependencies":[
    {"artifact":"spec/schema/protocol.v1.schema.json","sha256":"sha256:a81a44d3d572cc43bc459adc62374ee261549758e0687263a887a3774a863da2"},
    {"artifact":"spec/schema/m3-reactive.v1.schema.json","sha256":"sha256:58621bf3ab2b3f850b502cbfa22c87bc976c1baf915301586d9db0769a96632e"},
    {"artifact":"spec/loop-contract.v1.json","sha256":"sha256:223369c96d50db122f5d23133b8d2dce36768bd3b31adbca1626c86c3bcc5afa"},
    {"artifact":"spec/canonicalization.v1.json","sha256":"sha256:87b14b371d8572125164326b74d0574a11b00e4f11ba0c117dfe84644d1a7ccc"},
    {"artifact":"spec/run-fsm.v1.json","sha256":"sha256:043d8038f8bf91d7f60c2b57f7fcf788e25684eed6409f184b607fae227537ea"},
    {"artifact":"spec/m3-reactive-contract.v1.json","sha256":"sha256:c4bd93be23eccaa232c4f8b0e1f6e4047f9ed572625238fe3f4ee601b74fa297"},
    {"artifact":"spec/m3-manifest.v1.json","sha256":"sha256:c316151d051b1b1c4d547e32678f494c2473c1d6d50f96fad9c878ec3be337cf"},
    {"artifact":"fixtures/m3/golden/frontier-stable.transition.json","sha256":"sha256:e8ced5cb51dfc0b58ca99b30eb043be520fbd33431200f2a9d98f9dcfd1a781a"}
  ],
  "fixture":"fixtures/m4a/cases.json",
  "goldens":["fixtures/m4a/golden/low-risk.projection.json","fixtures/m4a/golden/approval-request.projection.json","fixtures/m4a/golden/approval-granted.projection.json"],
  "reference_implementation":["src/flrh_authority/__init__.py","src/flrh_authority/canonical.py","src/flrh_authority/authority.py"],
  "documentation":["docs/M4A_AUTHORITY.md"],
  "tools":["scripts/m4a_fixtures.py","scripts/m4a_oracle.py","scripts/run_m4a_replay.py","scripts/check_m4a_ambient.py","scripts/check_m4a_semantic_mutants.py","scripts/validate_m4a.py","tests/test_m4a_authority.py","tests/test_m4a_candidate_gate.py"],
  "completion_boundary":"PROPOSED only; supplied digests are self-consistency evidence, not authentication or provenance; no durability, effects, recovery, production, engine, efficacy, or scientific claim."
}
